key,path,exists,size_bytes,last_write_time,sha256,pages,page_size,creator,producer,first_text,note
target_view_main,E:\ns_mc_gan_gi_code_fcc_phase1\_manuscript_view\main.pdf,True,4166975,1782698048000000000,b43d71e1e7e84fcfccb7e46c5387c60b303d93b9ad5fc18e6417c382dea54b4f,19,612 x 792 pts (letter),LaTeX with hyperref,pdfTeX-1.40.26,"Retained iodine is not blocking iodine: | a dimensionless theory of dissolution-limited passivation | in the zinc–iodine flow battery positive electrode | Author One1 and Author Two1 | 1 | Affiliation, City, Country | Abstract | The positive (iodine) electrode limits the practical current and capacity of zinc–iodine flow bat-",user-specified PDF
target_view_SI,E:\ns_mc_gan_gi_code_fcc_phase1\_manuscript_view\SI.pdf,True,782085,1782698048000000000,193defa55c4761f5ff438aeb1f62e9fdfa1750a90e070bfcd5ebd9f2fb041ea1,5,612 x 792 pts (letter),LaTeX with hyperref,pdfTeX-1.40.26,Supplementary Information | Retained iodine is not blocking iodine: a dimensionless | theory of dissolution-limited passivation in the | zinc–iodine flow battery positive electrode | Contents | S1 Governing equations of the continuum full-cell model                                                 1 | S2 Molecular priors                                                                                     2 | S3 Mesoscale closures                                                                                   2,same preview folder SI
zifb_main,E:\zifb_final_9129_luck\manuscript\main.pdf,True,4166975,1782698032000000000,b43d71e1e7e84fcfccb7e46c5387c60b303d93b9ad5fc18e6417c382dea54b4f,19,612 x 792 pts (letter),LaTeX with hyperref,pdfTeX-1.40.26,"Retained iodine is not blocking iodine: | a dimensionless theory of dissolution-limited passivation | in the zinc–iodine flow battery positive electrode | Author One1 and Author Two1 | 1 | Affiliation, City, Country | Abstract | The positive (iodine) electrode limits the practical current and capacity of zinc–iodine flow bat-",previous ZIFB manuscript main.pdf
zifb_SI,E:\zifb_final_9129_luck\manuscript\SI.pdf,True,782085,1782689294000000000,193defa55c4761f5ff438aeb1f62e9fdfa1750a90e070bfcd5ebd9f2fb041ea1,5,612 x 792 pts (letter),LaTeX with hyperref,pdfTeX-1.40.26,Supplementary Information | Retained iodine is not blocking iodine: a dimensionless | theory of dissolution-limited passivation in the | zinc–iodine flow battery positive electrode | Contents | S1 Governing equations of the continuum full-cell model                                                 1 | S2 Molecular priors                                                                                     2 | S3 Mesoscale closures                                                                                   2,previous ZIFB manuscript SI.pdf
root_main,E:\ns_mc_gan_gi_code_fcc_phase1\main.pdf,True,1806655,1782561828000000000,b895f4231a1e2543c7aeb743d007d0e9e4620cbcce1a79a4d79ae9ed0c954e92,25,595.28 x 841.89 pts (A4),LaTeX with hyperref,xdvipdfmx (20240305),菲涅耳波带片的目标光场编码设计： | 稳妥基准方案与目标光场编码创新方案 | 项目组名称 | 2026 年 6 月 27 日 | 摘要 | 菲涅耳波带片通常被作为一种固定焦距的衍射透镜来研究，其基本实验往往是根据给定焦 | 距设计环带半径，然后验证其聚焦能力。然而，对于大学生物理实验竞赛而言，仅仅证明“波带 | 片能够聚焦”创新性不足。本项目尝试从波动光学和光场调控的角度重新理解菲涅耳波带片：,root main.pdf candidate
paper_main,E:\ns_mc_gan_gi_code_fcc_phase1\paper\main.pdf,True,737266,1781551410000000000,74a85d4a74e6dd7c7c6f0632e1793caecf4a6fb23913408aed115fa3ac768548,12,612 x 792 pts (letter),TeX,pdfTeX-1.40.26,"MEASUREMENT AUDITING FOR LEARNED GHOST IMAGING                                                                                     1 | Measurement Auditing for Learned Ghost Imaging: | Certificates, Limits, and Prior-Supplied Content | [Authors omitted for review] | Abstract—Learned ghost-imaging reconstructions can be vi-         is not a modeling assumption; it is the linear algebra of | sually plausible while still leaving unclear which image content     the measurement operator. The row component PR x is the | is supported by the recorded bucket measurements and which           part seen by the bucket measurements, while P0 x is exactly | content is supplied by the prior. This paper deve",paper/main.pdf candidate
